{
  "trace_version": "trace-v1",
  "run_id": "zero-toolset-live:13ce0c5c675e:2026-08-21T01:47:19.142914+00:00",
  "provenance": {
    "source": "live_zero_toolset",
    "adapter": "hermes_eval.trace.adapters.native",
    "fixture": "zero-toolset-live",
    "hermes_sha": "13ce0c5c675e843af70d19c9e5144249cd51c8d1",
    "harness_sha": "b92c29752e823227d5bbc0f8d16a5d1d6b7fb53c",
    "harness_dirty": true,
    "model": "qwen3.8:27b-ud-q4-k-xl",
    "provider": "custom",
    "classification": [
      "agent_behavior"
    ],
    "redaction": {
      "secrets": "fingerprint_only",
      "transcript": "omitted_or_hashed"
    }
  },
  "initial_state": {
    "status": "RUN",
    "reps": 10
  },
  "events": [
    {
      "id": "zero-toolset-live:13ce0c5c675e:2026-08-21T01:47:19.142914+00:00:0000",
      "seq": 0,
      "type": "state.snapshot",
      "span_id": "control:0",
      "parent_id": null,
      "ts": null,
      "redaction": {
        "secrets": "fingerprint_only",
        "transcript": "omitted_or_hashed"
      },
      "payload": {
        "arm": "control",
        "task_success": true,
        "proof_exists": true,
        "actual_tool_calls": 1,
        "tool_schema_count": 1
      }
    },
    {
      "id": "zero-toolset-live:13ce0c5c675e:2026-08-21T01:47:19.142914+00:00:0001",
      "seq": 1,
      "type": "model.request",
      "span_id": "control:0",
      "parent_id": null,
      "ts": null,
      "redaction": {
        "secrets": "fingerprint_only",
        "transcript": "omitted_or_hashed"
      },
      "payload": {
        "arm": "control",
        "model": "qwen3.8:27b-ud-q4-k-xl",
        "provider": "custom",
        "temperature": 0.0,
        "reasoning": "none",
        "prompt_chars": 191,
        "tool_schema_count": 1
      }
    },
    {
      "id": "zero-toolset-live:13ce0c5c675e:2026-08-21T01:47:19.142914+00:00:0002",
      "seq": 2,
      "type": "model.response",
      "span_id": "control:0",
      "parent_id": null,
      "ts": null,
      "redaction": {
        "secrets": "fingerprint_only",
        "transcript": "omitted_or_hashed"
      },
      "payload": {
        "textual_pseudo_tool_call": false,
        "pseudo_json_like": false,
        "pseudo_xml_function": false,
        "pseudo_other": false,
        "hallucinated_completion": false,
        "explicit_capability_failure": false,
        "remediation_requested": false,
        "other_tool_like_text": false,
        "plain_failure_other": false,
        "terminal_behavior": null,
        "transcript_sha256": null,
        "turns": 2,
        "stdout_chars": 132
      }
    },
    {
      "id": "zero-toolset-live:13ce0c5c675e:2026-08-21T01:47:19.142914+00:00:0003",
      "seq": 3,
      "type": "tool.call",
      "span_id": "control:0",
      "parent_id": null,
      "ts": "1787276684.7384942",
      "redaction": {
        "secrets": "fingerprint_only",
        "transcript": "omitted_or_hashed"
      },
      "payload": {
        "name": "write_file",
        "arguments": {
          "path": "/tmp/hermes-eval-home-t24qcbr0/control-0/proof.txt",
          "content": "LIVE-763ea28d9d0c-C"
        },
        "canonical_call_id": "EmD44tsO4tgVIVKlSaC011fJ45iZcLfG",
        "source": "hermes_session_db"
      }
    },
    {
      "id": "zero-toolset-live:13ce0c5c675e:2026-08-21T01:47:19.142914+00:00:0004",
      "seq": 4,
      "type": "tool.result",
      "span_id": "control:0",
      "parent_id": "zero-toolset-live:13ce0c5c675e:2026-08-21T01:47:19.142914+00:00:0003",
      "ts": "1787276684.825705",
      "redaction": {
        "secrets": "fingerprint_only",
        "transcript": "omitted_or_hashed"
      },
      "payload": {
        "name": "write_file",
        "status": "ok",
        "ok": true,
        "result": {
          "bytes_written": 19,
          "dirs_created": true,
          "verified": true,
          "lint": {
            "status": "skipped",
            "message": "No linter for .txt files"
          },
          "resolved_path": "/tmp/hermes-eval-home-t24qcbr0/control-0/proof.txt",
          "files_modified": [
            "/tmp/hermes-eval-home-t24qcbr0/control-0/proof.txt"
          ]
        },
        "canonical_call_id": "EmD44tsO4tgVIVKlSaC011fJ45iZcLfG",
        "source": "hermes_session_db"
      }
    },
    {
      "id": "zero-toolset-live:13ce0c5c675e:2026-08-21T01:47:19.142914+00:00:0005",
      "seq": 5,
      "type": "final.output",
      "span_id": "control:0",
      "parent_id": null,
      "ts": null,
      "redaction": {
        "secrets": "fingerprint_only",
        "transcript": "omitted_or_hashed"
      },
      "payload": {
        "proof_exists": true,
        "task_success": true,
        "input_tokens": 13669,
        "output_tokens": 117,
        "total_tokens": 27271,
        "cache_read_tokens": 13485,
        "cache_write_tokens": 0,
        "duration_ms": 8190.1,
        "oracle": "filesystem_nonce_proof"
      }
    },
    {
      "id": "zero-toolset-live:13ce0c5c675e:2026-08-21T01:47:19.142914+00:00:0006",
      "seq": 6,
      "type": "state.snapshot",
      "span_id": "control:1",
      "parent_id": null,
      "ts": null,
      "redaction": {
        "secrets": "fingerprint_only",
        "transcript": "omitted_or_hashed"
      },
      "payload": {
        "arm": "control",
        "task_success": true,
        "proof_exists": true,
        "actual_tool_calls": 1,
        "tool_schema_count": 1
      }
    },
    {
      "id": "zero-toolset-live:13ce0c5c675e:2026-08-21T01:47:19.142914+00:00:0007",
      "seq": 7,
      "type": "model.request",
      "span_id": "control:1",
      "parent_id": null,
      "ts": null,
      "redaction": {
        "secrets": "fingerprint_only",
        "transcript": "omitted_or_hashed"
      },
      "payload": {
        "arm": "control",
        "model": "qwen3.8:27b-ud-q4-k-xl",
        "provider": "custom",
        "temperature": 0.0,
        "reasoning": "none",
        "prompt_chars": 191,
        "tool_schema_count": 1
      }
    },
    {
      "id": "zero-toolset-live:13ce0c5c675e:2026-08-21T01:47:19.142914+00:00:0008",
      "seq": 8,
      "type": "model.response",
      "span_id": "control:1",
      "parent_id": null,
      "ts": null,
      "redaction": {
        "secrets": "fingerprint_only",
        "transcript": "omitted_or_hashed"
      },
      "payload": {
        "textual_pseudo_tool_call": false,
        "pseudo_json_like": false,
        "pseudo_xml_function": false,
        "pseudo_other": false,
        "hallucinated_completion": false,
        "explicit_capability_failure": false,
        "remediation_requested": false,
        "other_tool_like_text": false,
        "plain_failure_other": false,
        "terminal_behavior": null,
        "transcript_sha256": null,
        "turns": 2,
        "stdout_chars": 100
      }
    },
    {
      "id": "zero-toolset-live:13ce0c5c675e:2026-08-21T01:47:19.142914+00:00:0009",
      "seq": 9,
      "type": "tool.call",
      "span_id": "control:1",
      "parent_id": null,
      "ts": "1787276696.1411462",
      "redaction": {
        "secrets": "fingerprint_only",
        "transcript": "omitted_or_hashed"
      },
      "payload": {
        "name": "write_file",
        "arguments": {
          "content": "LIVE-77d452c3beb1-C",
          "path": "/tmp/hermes-eval-home-t24qcbr0/control-1/proof.txt"
        },
        "canonical_call_id": "q2xJebv6b8zz8QFnaj863yrudlIobkqg",
        "source": "hermes_session_db"
      }
    },
    {
      "id": "zero-toolset-live:13ce0c5c675e:2026-08-21T01:47:19.142914+00:00:0010",
      "seq": 10,
      "type": "tool.result",
      "span_id": "control:1",
      "parent_id": "zero-toolset-live:13ce0c5c675e:2026-08-21T01:47:19.142914+00:00:0009",
      "ts": "1787276696.2127345",
      "redaction": {
        "secrets": "fingerprint_only",
        "transcript": "omitted_or_hashed"
      },
      "payload": {
        "name": "write_file",
        "status": "ok",
        "ok": true,
        "result": {
          "bytes_written": 19,
          "dirs_created": true,
          "verified": true,
          "lint": {
            "status": "skipped",
            "message": "No linter for .txt files"
          },
          "resolved_path": "/tmp/hermes-eval-home-t24qcbr0/control-1/proof.txt",
          "files_modified": [
            "/tmp/hermes-eval-home-t24qcbr0/control-1/proof.txt"
          ]
        },
        "canonical_call_id": "q2xJebv6b8zz8QFnaj863yrudlIobkqg",
        "source": "hermes_session_db"
      }
    },
    {
      "id": "zero-toolset-live:13ce0c5c675e:2026-08-21T01:47:19.142914+00:00:0011",
      "seq": 11,
      "type": "final.output",
      "span_id": "control:1",
      "parent_id": null,
      "ts": null,
      "redaction": {
        "secrets": "fingerprint_only",
        "transcript": "omitted_or_hashed"
      },
      "payload": {
        "proof_exists": true,
        "task_success": true,
        "input_tokens": 13590,
        "output_tokens": 115,
        "total_tokens": 27254,
        "cache_read_tokens": 13549,
        "cache_write_tokens": 0,
        "duration_ms": 8119.3,
        "oracle": "filesystem_nonce_proof"
      }
    },
    {
      "id": "zero-toolset-live:13ce0c5c675e:2026-08-21T01:47:19.142914+00:00:0012",
      "seq": 12,
      "type": "state.snapshot",
      "span_id": "control:2",
      "parent_id": null,
      "ts": null,
      "redaction": {
        "secrets": "fingerprint_only",
        "transcript": "omitted_or_hashed"
      },
      "payload": {
        "arm": "control",
        "task_success": true,
        "proof_exists": true,
        "actual_tool_calls": 1,
        "tool_schema_count": 1
      }
    },
    {
      "id": "zero-toolset-live:13ce0c5c675e:2026-08-21T01:47:19.142914+00:00:0013",
      "seq": 13,
      "type": "model.request",
      "span_id": "control:2",
      "parent_id": null,
      "ts": null,
      "redaction": {
        "secrets": "fingerprint_only",